{
  "schema_version": "hsie-world-reference/0.1",
  "request_id": "request:001",
  "request_type": "DOMAIN_OPERATION",
  "session_ref": "session:visitor-001",
  "caller_ref": "client:web-reference",
  "actor_ref": null,
  "target_domain": "BUSINESS",
  "target_ref": "business:lagoon-cuts-demo",
  "operation": "ACTIVATE_BUSINESS_PLACE",
  "purpose": "Reference contract fixture only",
  "input": {},
  "expected_state_version": 1,
  "correlation_id": "correlation:001",
  "created_at": "2026-09-27T04:40:00Z",
  "status": "PROPOSED"
}
